{
  "_comment": "Final structured ticket summary; trace.tool_result references this via artifact_id",
  "schema_version": "incident_summary_v1",
  "summary": "Several users have been failing VPN authentication since 09:00 today ('authentication failed' / 'ike sa establishment failed'). The endpoint and network paths have been cross-validated (different hosts, mobile hotspot — all fail), so the issue is most likely on the server-side authentication chain. Suggested priority: investigate the VPN gateway and the auth backend.",
  "symptoms": [
    "authentication failed",
    "ike sa establishment failed"
  ],
  "scope": "multiple_users",
  "tried_steps": [
    "Restarted the VPN client",
    "Switched network to mobile hotspot",
    "Tested from a different host"
  ],
  "missing_fields": [
    "VPN client version",
    "List of affected accounts",
    "Whether any change window occurred around 09:00"
  ],
  "tasks": [
    {
      "ref": "task-1",
      "action": "Verify VPN gateway and auth services (RADIUS / AD LDAP) health",
      "rationale": "When several users fail authentication simultaneously the issue is almost always on the server-side auth chain, not the endpoint",
      "tier": "L2",
      "citations": [
        "kb-1"
      ]
    },
    {
      "ref": "task-2",
      "action": "Ask the user for VPN client version and the list of affected accounts",
      "rationale": "Missing fields will block L2 from reproducing",
      "tier": "L1",
      "citations": []
    },
    {
      "ref": "task-3",
      "action": "Check whether any change window occurred around 09:00 (DNS / certs / firewall)",
      "rationale": "Certificate expiry or clock skew can cause auth failures",
      "tier": "L2",
      "citations": [
        "kb-1"
      ]
    }
  ],
  "severity_suggested": "P2",
  "escalation_hint": "Multiple users affected + no auth records on server → L2 networking team",
  "citations": [
    {
      "id": "kb-1",
      "chunk_id": "chk_e3fe2afe",
      "document_id": "doc_afe80531",
      "source_path": "examples/scn_ticket_summary_en/kb/sop_vpn_en.md",
      "line_start": 37,
      "line_end": 46,
      "heading_path": [
        "VPN Troubleshooting SOP",
        "2. Investigation order",
        "2.1 Authentication errors"
      ]
    }
  ],
  "work_item_ref": "T-YYYY",
  "work_item_type": "incident"
}
